{
  "schema_version": "1.0",
  "organization_id": "org_1",
  "user_id": "user_1",
  "agent_id": "agent_1",
  "server_id": "server_1",
  "request_id": "req_approval_1",
  "correlation_id": "corr_control_1",
  "idempotency_key": "idem_approval_1",
  "created_at": "2026-07-18T00:03:00Z",
  "revision": 1,
  "sequence": 4,
  "signature": {
    "algorithm": "ed25519",
    "key_id": "key_1",
    "value": "DDDDDDDDDDDDDDDDDDDDDDDDDDDDDDDDDDDDDDDDDDDDDDDDDDDDDD==",
    "signed_at": "2026-07-18T00:03:01Z"
  },
  "approval_id": "approval_1",
  "command_id": "command_delete_1",
  "action": "deployment.delete",
  "risk_level": "high",
  "requested_by": "user_1",
  "decision": "approved",
  "decided_by": "user_2",
  "reason_code": "operator_requested",
  "reason_ref": "ref:approval-reason-1",
  "expires_at": "2026-07-18T01:03:00Z",
  "decided_at": "2026-07-18T00:03:02Z",
  "scope": {
    "deployment_id": "deployment_1",
    "organization_id": "org_1",
    "user_id": "user_1",
    "agent_id": "agent_1",
    "server_id": "server_1"
  }
}
